{
  "profile": "nightseam.duplex/1",
  "parameters": [
    {
      "name": "A",
      "of": "session"
    },
    {
      "name": "B",
      "of": "session"
    }
  ],
  "types": {
    "Borrowed": {
      "kind": "record",
      "fields": [
        {
          "name": "frame",
          "type": {
            "apply": "carrier.Frame",
            "with": {
              "S": "B"
            }
          }
        }
      ]
    },
    "Both": {
      "kind": "record",
      "fields": [
        {
          "name": "mine",
          "type": "Mine"
        },
        {
          "name": "borrowed",
          "type": "Borrowed"
        },
        {
          "name": "fixed",
          "type": "Fixed"
        }
      ]
    },
    "Fixed": {
      "kind": "record",
      "fields": [
        {
          "name": "frame",
          "type": {
            "apply": "carrier.Frame",
            "with": {
              "S": "probe"
            }
          }
        }
      ]
    },
    "Mine": {
      "kind": "record",
      "fields": [
        {
          "name": "held",
          "type": "A.Envelope"
        }
      ]
    }
  },
  "server": {
    "methods": {
      "look": {
        "request": "Mine",
        "result": "Both"
      }
    }
  }
}
