{
  "profile": "nightseam.duplex/1",
  "parameters": [
    {
      "name": "S",
      "of": "session"
    }
  ],
  "types": {
    "Held": {
      "kind": "record",
      "fields": [
        {
          "name": "payload",
          "type": "S.Payload"
        },
        {
          "name": "message",
          "type": "S.Envelope"
        }
      ]
    }
  },
  "server": {
    "methods": {
      "hold": {
        "request": "Held",
        "result": "S.Payload"
      }
    }
  }
}
